{
  "schemaVersion": "1.0.0",
  "algorithmVersion": "1.0.0",
  "songId": "zuguo-zuguo-women-ai-ni",
  "stageId": "stage_1",
  "sourceScoreStatus": "verified",
  "sourceScoreVerifiedAt": "2026-08-28T09:51:25.805Z",
  "generatedAt": "2026-08-28T09:51:31.240Z",
  "facts": {
    "meter": {
      "beats": 2,
      "unit": 4
    },
    "bpm": 72,
    "usedDegrees": [
      1,
      2,
      3,
      4,
      5,
      6,
      7
    ],
    "pitchRangeSemitones": 12,
    "restOccurrences": [
      {
        "measure": 2,
        "noteId": "m002_n002",
        "beat": 1,
        "duration": 1,
        "phraseId": "phrase_01"
      },
      {
        "measure": 4,
        "noteId": "m004_n002",
        "beat": 1,
        "duration": 1,
        "phraseId": "phrase_02"
      },
      {
        "measure": 8,
        "noteId": "m008_n004",
        "beat": 1.5,
        "duration": 0.5,
        "phraseId": null
      },
      {
        "measure": 10,
        "noteId": "m010_n002",
        "beat": 1,
        "duration": 1,
        "phraseId": null
      },
      {
        "measure": 12,
        "noteId": "m012_n002",
        "beat": 1,
        "duration": 1,
        "phraseId": null
      },
      {
        "measure": 29,
        "noteId": "m029_n003",
        "beat": 1.5,
        "duration": 0.5,
        "phraseId": null
      },
      {
        "measure": 30,
        "noteId": "m030_n004",
        "beat": 1.5,
        "duration": 0.5,
        "phraseId": null
      },
      {
        "measure": 33,
        "noteId": "m033_n003",
        "beat": 1.5,
        "duration": 0.5,
        "phraseId": null
      },
      {
        "measure": 34,
        "noteId": "m034_n004",
        "beat": 1.5,
        "duration": 0.5,
        "phraseId": null
      },
      {
        "measure": 36,
        "noteId": "m036_n002",
        "beat": 1,
        "duration": 1,
        "phraseId": null
      }
    ]
  },
  "materials": {
    "rhythm": [
      {
        "materialId": "PAT-01",
        "module": "rhythm",
        "name": "一拍一次",
        "level": "core",
        "notation": "♩ ♩",
        "chant": [
          "da",
          "da"
        ],
        "matchType": "deterministic",
        "confidence": 1,
        "reviewRequired": false,
        "occurrences": [
          {
            "occurrenceId": "PAT-01@m6:m006_n001",
            "measureStart": 6,
            "measureEnd": 6,
            "startNoteId": "m006_n001",
            "endNoteId": "m006_n002",
            "startBeat": 0,
            "endBeat": 2,
            "noteIds": [
              "m006_n001",
              "m006_n002"
            ],
            "durations": [
              1,
              1
            ],
            "phraseIds": [
              "phrase_03"
            ]
          },
          {
            "occurrenceId": "PAT-01@m26:m026_n001",
            "measureStart": 26,
            "measureEnd": 26,
            "startNoteId": "m026_n001",
            "endNoteId": "m026_n002",
            "startBeat": 0,
            "endBeat": 2,
            "noteIds": [
              "m026_n001",
              "m026_n002"
            ],
            "durations": [
              1,
              1
            ],
            "phraseIds": []
          }
        ]
      },
      {
        "materialId": "PAT-02",
        "module": "rhythm",
        "name": "一拍两次",
        "level": "core",
        "notation": "♪♪ ♪♪",
        "chant": [
          "de",
          "de",
          "de",
          "de"
        ],
        "matchType": "deterministic",
        "confidence": 1,
        "reviewRequired": false,
        "occurrences": [
          {
            "occurrenceId": "PAT-02@m1:m001_n001",
            "measureStart": 1,
            "measureEnd": 1,
            "startNoteId": "m001_n001",
            "endNoteId": "m001_n004",
            "startBeat": 0,
            "endBeat": 2,
            "noteIds": [
              "m001_n001",
              "m001_n002",
              "m001_n003",
              "m001_n004"
            ],
            "durations": [
              0.5,
              0.5,
              0.5,
              0.5
            ],
            "phraseIds": [
              "phrase_01"
            ]
          },
          {
            "occurrenceId": "PAT-02@m3:m003_n001",
            "measureStart": 3,
            "measureEnd": 3,
            "startNoteId": "m003_n001",
            "endNoteId": "m003_n004",
            "startBeat": 0,
            "endBeat": 2,
            "noteIds": [
              "m003_n001",
              "m003_n002",
              "m003_n003",
              "m003_n004"
            ],
            "durations": [
              0.5,
              0.5,
              0.5,
              0.5
            ],
            "phraseIds": [
              "phrase_02"
            ]
          },
          {
            "occurrenceId": "PAT-02@m5:m005_n001",
            "measureStart": 5,
            "measureEnd": 5,
            "startNoteId": "m005_n001",
            "endNoteId": "m005_n004",
            "startBeat": 0,
            "endBeat": 2,
            "noteIds": [
              "m005_n001",
              "m005_n002",
              "m005_n003",
              "m005_n004"
            ],
            "durations": [
              0.5,
              0.5,
              0.5,
              0.5
            ],
            "phraseIds": [
              "phrase_03"
            ]
          },
          {
            "occurrenceId": "PAT-02@m9:m009_n001",
            "measureStart": 9,
            "measureEnd": 9,
            "startNoteId": "m009_n001",
            "endNoteId": "m009_n004",
            "startBeat": 0,
            "endBeat": 2,
            "noteIds": [
              "m009_n001",
              "m009_n002",
              "m009_n003",
              "m009_n004"
            ],
            "durations": [
              0.5,
              0.5,
              0.5,
              0.5
            ],
            "phraseIds": []
          },
          {
            "occurrenceId": "PAT-02@m11:m011_n001",
            "measureStart": 11,
            "measureEnd": 11,
            "startNoteId": "m011_n001",
            "endNoteId": "m011_n004",
            "startBeat": 0,
            "endBeat": 2,
            "noteIds": [
              "m011_n001",
              "m011_n002",
              "m011_n003",
              "m011_n004"
            ],
            "durations": [
              0.5,
              0.5,
              0.5,
              0.5
            ],
            "phraseIds": []
          },
          {
            "occurrenceId": "PAT-02@m13:m013_n001",
            "measureStart": 13,
            "measureEnd": 13,
            "startNoteId": "m013_n001",
            "endNoteId": "m013_n004",
            "startBeat": 0,
            "endBeat": 2,
            "noteIds": [
              "m013_n001",
              "m013_n002",
              "m013_n003",
              "m013_n004"
            ],
            "durations": [
              0.5,
              0.5,
              0.5,
              0.5
            ],
            "phraseIds": []
          },
          {
            "occurrenceId": "PAT-02@m14:m014_n001",
            "measureStart": 14,
            "measureEnd": 14,
            "startNoteId": "m014_n001",
            "endNoteId": "m014_n004",
            "startBeat": 0,
            "endBeat": 2,
            "noteIds": [
              "m014_n001",
              "m014_n002",
              "m014_n003",
              "m014_n004"
            ],
            "durations": [
              0.5,
              0.5,
              0.5,
              0.5
            ],
            "phraseIds": []
          },
          {
            "occurrenceId": "PAT-02@m16:m016_n001",
            "measureStart": 16,
            "measureEnd": 16,
            "startNoteId": "m016_n001",
            "endNoteId": "m016_n004",
            "startBeat": 0,
            "endBeat": 2,
            "noteIds": [
              "m016_n001",
              "m016_n002",
              "m016_n003",
              "m016_n004"
            ],
            "durations": [
              0.5,
              0.5,
              0.5,
              0.5
            ],
            "phraseIds": []
          },
          {
            "occurrenceId": "PAT-02@m19:m019_n001",
            "measureStart": 19,
            "measureEnd": 19,
            "startNoteId": "m019_n001",
            "endNoteId": "m019_n004",
            "startBeat": 0,
            "endBeat": 2,
            "noteIds": [
              "m019_n001",
              "m019_n002",
              "m019_n003",
              "m019_n004"
            ],
            "durations": [
              0.5,
              0.5,
              0.5,
              0.5
            ],
            "phraseIds": []
          },
          {
            "occurrenceId": "PAT-02@m23:m023_n001",
            "measureStart": 23,
            "measureEnd": 23,
            "startNoteId": "m023_n001",
            "endNoteId": "m023_n004",
            "startBeat": 0,
            "endBeat": 2,
            "noteIds": [
              "m023_n001",
              "m023_n002",
              "m023_n003",
              "m023_n004"
            ],
            "durations": [
              0.5,
              0.5,
              0.5,
              0.5
            ],
            "phraseIds": []
          },
          {
            "occurrenceId": "PAT-02@m27:m027_n001",
            "measureStart": 27,
            "measureEnd": 27,
            "startNoteId": "m027_n001",
            "endNoteId": "m027_n004",
            "startBeat": 0,
            "endBeat": 2,
            "noteIds": [
              "m027_n001",
              "m027_n002",
              "m027_n003",
              "m027_n004"
            ],
            "durations": [
              0.5,
              0.5,
              0.5,
              0.5
            ],
            "phraseIds": []
          },
          {
            "occurrenceId": "PAT-02@m31:m031_n001",